{"contract":1,"counts":{"call_sites":{"src":"facts/syntax.json#call_edge inside a function","unit":"count","value":3},"calls":{"src":"facts/syntax.json#call_edge resolved to a function of this project (facts/code/flows.py resolve_callee)","unit":"count","value":1},"functions":{"src":"facts/syntax.json#symbol[kind in function, method] + engines lizard rows the parser did not read","unit":"count","value":5},"modules":{"src":"files holding at least one function","unit":"count","value":5},"reads":{"src":"facts/entrypoints.json#data_access + facts/config.json#env_read, in the innermost function","unit":"count","value":0},"writes":{"src":"facts/entrypoints.json#data_access[operation writes]","unit":"count","value":0}},"functions":[{"callees":["app/prices.py#price"],"callers":[],"cards":[],"complexity":{"src":"facts/metrics.json#metric.value.complexity","unit":"count","value":1},"end_line":5,"exported":true,"id":"app/main.py#run","kind":"function","language":"Python","line":4,"lines":{"src":"facts/metrics.json#metric.value.lines","unit":"lines","value":2},"module":"app/main.py","name":"run","reads":[],"signature":"run()","summary":null,"writes":[]},{"callees":[],"callers":[],"cards":["TASK-001"],"complexity":{"src":"facts/metrics.json#metric.value.complexity","unit":"count","value":1},"end_line":2,"exported":true,"id":"app/old_export.py#legacy_export","kind":"function","language":"Python","line":1,"lines":{"src":"facts/metrics.json#metric.value.lines","unit":"lines","value":2},"module":"app/old_export.py","name":"legacy_export","reads":[],"signature":"legacy_export(rows)","summary":null,"writes":[]},{"callees":[],"callers":[],"cards":["TASK-002"],"complexity":{"src":"facts/metrics.json#metric.value.complexity","unit":"count","value":1},"end_line":2,"exported":true,"id":"app/old_mail.py#legacy_mail","kind":"function","language":"Python","line":1,"lines":{"src":"facts/metrics.json#metric.value.lines","unit":"lines","value":2},"module":"app/old_mail.py","name":"legacy_mail","reads":[],"signature":"legacy_mail(to)","summary":null,"writes":[]},{"callees":[],"callers":[],"cards":["TASK-003"],"complexity":{"src":"facts/metrics.json#metric.value.complexity","unit":"count","value":1},"end_line":2,"exported":true,"id":"app/old_report.py#legacy_total","kind":"function","language":"Python","line":1,"lines":{"src":"facts/metrics.json#metric.value.lines","unit":"lines","value":2},"module":"app/old_report.py","name":"legacy_total","reads":[],"signature":"legacy_total(rows)","summary":null,"writes":[]},{"callees":[],"callers":["app/main.py#run"],"cards":[],"complexity":{"src":"facts/metrics.json#metric.value.complexity","unit":"count","value":1},"end_line":2,"exported":true,"id":"app/prices.py#price","kind":"function","language":"Python","line":1,"lines":{"src":"facts/metrics.json#metric.value.lines","unit":"lines","value":2},"module":"app/prices.py","name":"price","reads":[],"signature":"price(n)","summary":null,"writes":[]}],"languages":[{"functions":{"src":"facts/syntax.json#symbol[kind in function, method] + engines lizard rows the parser did not read","unit":"count","value":5},"id":"Python","state":"measured"}],"missing":[],"modules":[{"component":"app","functions":1,"id":"app/main.py","language":"Python"},{"component":"app","functions":1,"id":"app/old_export.py","language":"Python"},{"component":"app","functions":1,"id":"app/old_mail.py","language":"Python"},{"component":"app","functions":1,"id":"app/old_report.py","language":"Python"},{"component":"app","functions":1,"id":"app/prices.py","language":"Python"}],"revision":2,"schema_version":1}